{
  "$schema": "https://json-schema.org/draft/2020-12/schema",
  "$id": "https://geordi.local/schemas/system-profile-v3.schema.json",
  "title": "{{productName}} System Profile",
  "description": "The normalized profile contract shared by synthetic profiles and live system scans.",
  "type": "object",
  "additionalProperties": false,
  "required": ["schemaVersion", "id", "name", "summary", "entities", "relationships"],
  "properties": {
    "schemaVersion": { "const": 3 },
    "id": { "$ref": "#/$defs/nonEmptyString" },
    "name": { "$ref": "#/$defs/nonEmptyString" },
    "summary": { "$ref": "#/$defs/nonEmptyString" },
    "entities": {
      "type": "array",
      "items": { "$ref": "#/$defs/entity" }
    },
    "relationships": {
      "type": "array",
      "items": { "$ref": "#/$defs/relationship" }
    }
  },
  "$defs": {
    "nonEmptyString": {
      "type": "string",
      "minLength": 1
    },
    "entityType": {
      "type": "string",
      "enum": [
        "application",
        "process",
        "file",
        "persistence",
        "resource",
        "incident",
        "event",
        "packageManager",
        "shellFramework",
        "package"
      ]
    },
    "relationshipType": {
      "type": "string",
      "enum": [
        "owns",
        "provides",
        "launches",
        "reads and writes",
        "persists through",
        "consumes",
        "contributes to",
        "occurred near",
        "may belong to",
              "shares",
              "observed running"
      ]
    },
    "confidence": {
      "type": "string",
      "enum": ["possible", "probable", "high", "confirmed", "ambiguous"]
    },
    "evidenceKind": {
      "type": "string",
      "enum": ["observed", "derived", "inferred"]
    },
    "presentationTint": {
      "type": "string",
      "enum": ["accent", "blue", "cyan", "green", "mint", "orange", "purple", "red"]
    },
    "detail": {
      "type": "object",
      "additionalProperties": false,
      "required": ["label", "value"],
      "properties": {
        "label": { "$ref": "#/$defs/nonEmptyString" },
        "value": { "type": "string" }
      }
    },
    "entityInstance": {
      "type": "object",
      "additionalProperties": false,
      "required": ["id", "details"],
      "properties": {
        "id": { "$ref": "#/$defs/nonEmptyString" },
        "details": {
          "type": "array",
          "items": { "$ref": "#/$defs/detail" }
        }
      }
    },
    "entity": {
      "type": "object",
      "additionalProperties": false,
      "required": ["id", "type", "name", "summary", "details"],
      "properties": {
        "id": { "$ref": "#/$defs/nonEmptyString" },
        "type": { "$ref": "#/$defs/entityType" },
        "name": { "$ref": "#/$defs/nonEmptyString" },
        "summary": { "$ref": "#/$defs/nonEmptyString" },
        "details": {
          "type": "array",
          "items": { "$ref": "#/$defs/detail" }
        },
        "instances": {
          "type": "array",
          "items": { "$ref": "#/$defs/entityInstance" }
        },
        "presentation": { "$ref": "#/$defs/presentation" }
      }
    },
    "presentation": {
      "type": "object",
      "additionalProperties": false,
      "required": ["symbol", "tint"],
      "properties": {
        "symbol": { "$ref": "#/$defs/nonEmptyString" },
        "tint": { "$ref": "#/$defs/presentationTint" },
        "subtitle": { "$ref": "#/$defs/nonEmptyString" },
        "trailingDetailLabel": { "$ref": "#/$defs/nonEmptyString" }
      }
    },
    "observationID": {
      "type": "object",
      "additionalProperties": false,
      "required": ["rawValue"],
      "properties": {
        "rawValue": { "$ref": "#/$defs/nonEmptyString" }
      }
    },
    "evidence": {
      "type": "object",
      "additionalProperties": false,
      "required": ["id", "kind", "summary", "source"],
      "properties": {
        "id": { "$ref": "#/$defs/nonEmptyString" },
        "kind": { "$ref": "#/$defs/evidenceKind" },
        "summary": { "$ref": "#/$defs/nonEmptyString" },
        "source": { "$ref": "#/$defs/nonEmptyString" },
        "observationID": { "$ref": "#/$defs/observationID" },
        "observedAt": { "type": "number" },
        "ruleID": { "$ref": "#/$defs/nonEmptyString" },
        "ruleVersion": {
          "type": "integer",
          "minimum": 1
        }
      }
    },
    "relationship": {
      "type": "object",
      "additionalProperties": false,
      "required": [
        "id",
        "source",
        "target",
        "type",
        "confidence",
        "explanation",
        "evidence"
      ],
      "properties": {
        "id": { "$ref": "#/$defs/nonEmptyString" },
        "source": { "$ref": "#/$defs/nonEmptyString" },
        "target": { "$ref": "#/$defs/nonEmptyString" },
        "type": { "$ref": "#/$defs/relationshipType" },
        "confidence": { "$ref": "#/$defs/confidence" },
        "explanation": { "$ref": "#/$defs/nonEmptyString" },
        "evidence": {
          "type": "array",
          "minItems": 1,
          "items": { "$ref": "#/$defs/evidence" }
        }
      }
    }
  }
}
