{
  "entities" : [
    {
      "details" : [
        {
          "label" : "Identity",
          "value" : "Northstar Notes"
        },
        {
          "label" : "Origin",
          "value" : "App Store"
        },
        {
          "label" : "State",
          "value" : "Installed · Approved · Running"
        }
      ],
      "id" : "app.notes",
      "name" : "Northstar Notes",
      "summary" : "A signed note-taking application.",
      "type" : "application"
    },
    {
      "details" : [

      ],
      "id" : "process.notes",
      "name" : "Northstar Notes process",
      "summary" : "The application's main running process.",
      "type" : "process"
    },
    {
      "details" : [
        {
          "label" : "Data class",
          "value" : "Private application support"
        },
        {
          "label" : "Activity",
          "value" : "Recently used"
        }
      ],
      "id" : "file.notes",
      "name" : "Northstar support folder",
      "summary" : "Preferences and local support data.",
      "type" : "file"
    },
    {
      "details" : [
        {
          "label" : "Memory",
          "value" : "182 MB"
        },
        {
          "label" : "CPU",
          "value" : "1.2%"
        }
      ],
      "id" : "resource.notes",
      "name" : "Ordinary resource use",
      "summary" : "Low CPU and memory use in this scenario.",
      "type" : "resource"
    }
  ],
  "id" : "simple-application",
  "name" : "Simple application",
  "relationships" : [
    {
      "confidence" : "confirmed",
      "evidence" : [
        {
          "id" : "notes-process-record",
          "kind" : "observed",
          "source" : "Synthetic process observation",
          "summary" : "The process record names Northstar Notes as its executable."
        }
      ],
      "explanation" : "Northstar Notes launched its main process.",
      "id" : "notes-launches",
      "source" : "app.notes",
      "target" : "process.notes",
      "type" : "launches"
    },
    {
      "confidence" : "high",
      "evidence" : [
        {
          "id" : "notes-file-activity",
          "kind" : "observed",
          "source" : "Synthetic file event",
          "summary" : "File activity occurred while the process was active."
        },
        {
          "id" : "notes-path-match",
          "kind" : "inferred",
          "source" : "Relationship rule v1",
          "summary" : "The folder identity matches the application identity."
        }
      ],
      "explanation" : "The running application uses this support folder.",
      "id" : "notes-files",
      "source" : "process.notes",
      "target" : "file.notes",
      "type" : "reads and writes"
    },
    {
      "confidence" : "confirmed",
      "evidence" : [
        {
          "id" : "notes-resource-sample",
          "kind" : "observed",
          "source" : "Synthetic resource sample",
          "summary" : "The sample identifies the process as the contributor."
        }
      ],
      "explanation" : "The process accounts for this measured resource use.",
      "id" : "notes-resource",
      "source" : "process.notes",
      "target" : "resource.notes",
      "type" : "consumes"
    }
  ],
  "schemaVersion" : 3,
  "summary" : "A straightforward application with one process and ordinary activity."
}
